Source,Date,Title,Brief,Url 1,Full Story,URL 2,Check Url
VOAB,1/31/2017,ရခိုင္ေကာ္မရွင္အစီရင္ခံတင္ဖ္ို႔ ရက္ေရႊ႕ဆိုင္း,ရခိုင္ျပည္နယ္ေမာင္ေတာေဒသမွာ ျဖစ္ပြားခဲ့တဲ့အၾကမ္းဖက္ တုိက္ခိုက္မႈေတြနဲ႔ပတ္သက္ၿပီး ဖဲြ႔စည္းခဲ့တဲ့ စံုစမ္းစစ္ေဆးေရးေကာ္မရွင္ရဲ့ အစီရင္ခံစာကို ဒီလ ၃၁ရက္ေန႔မွာ တင္ျပရမယ့္အစား ရက္အကန္႔အသတ္ မရိွ အခ်ိန္တုိးျမွင့္သတ္မွတ္လုိက္ပါတယ္။,https://burmese.voanews.com/a/rahkine-investigation-commission-/3699917.html,ရခိုင္ျပည္နယ္ေမာင္ေတာေဒသမွာ ျဖစ္ပြားခဲ့တဲ့အၾကမ္းဖက္ တုိက္ခိုက္မႈေတြနဲ႔ပတ္သက္ၿပီး ဖဲြ႔စည္းခဲ့တဲ့ စံုစမ္းစစ္ေဆးေရးေကာ္မရွင္ရဲ့ အစီရင္ခံစာကို ဒီလ ၃၁ရက္ေန႔မွာ တင္ျပရမယ့္အစား ရက္အကန္႔အသတ္မရိွ အခ်ိန္တုိးျမွင့္သတ္မွတ္လုိက္ပါတယ္။ ဒီလုိ တုိးျမွင့္ေပးလုိက္တာကေတာ့ ရခုိင္ျပည္နယ္အတြင္း လူ႔အခြင့္အေရးနဲ႔ပတ္သက္တဲ့စြပ္စဲြခ်က္အသစ္ေတြ ထပ္မံေပၚေပါက္လာတာေၾကာင့္လုိ႔ ႏိုင္ငံေတာ္သမၼတရံုးက ထုတ္ျပန္ပါတယ္။ ဒီသတင္းကိုေတာ့ ဗီြအုိေအျမန္မာပိုင္းရဲ့သတင္းေထာက္ ကိုမုိးေဇာ္က တင္ျပထားပါတယ္။ၿပီးခဲ့တဲ့ႏွစ္ ေအာက္တုိဘာလနဲ႔ ႏို၀င္ဘာလအတြင္းမွာ ျဖစ္ေပၚခဲ့တဲ့ အၾကမ္းဖက္ တုိက္ခိုက္တာေတြနဲ႔ပတ္သက္ၿပီး ေနာက္ခံအေျခအေနနဲ႔ အျဖစ္မွန္ေပၚေပါက္ေစဖုိ႔၊ ဒီလုိ အျဖစ္မ်ိဳး ေနာက္တၾကိမ္ ထပ္မံမျဖစ္ပြားေစဖို႔အတြက္ စံုစမ္းစစ္ေဆးေရးေကာ္မရွင္ကို ၂၀၁၆ခုႏွစ္ ဒီဇင္ဘာလ ၁ရက္ေန႔မွာ ႏိုင္ငံေတာ္သမၼတက ဖဲြ႔စည္းခဲ့တာျဖစ္ပါတယ္။ ဒီေကာ္မရွင္ကို ဒုသမၼတ ဦးျမင့္ေဆြက ဦးေဆာင္ၿပီး နယ္ပယ္အသီးသီးက လူပုဂၢိဳလ္ ၁၃ေယာက္နဲ႔ ဖဲြ႔စည္းခဲ့သလို ေကာ္မရွင္ရဲ့အစီရင္ခံစာကို ဒီလ ၃၁ရက္ေန႔ ေနာက္ဆံုးထား တင္ျပဖို႔ သတ္မွတ္ခဲ့တာျဖစ္ပါတယ္။ဒီလ ၃၀ရက္ေန႔မွာေတာ့ လူ႔အခြင့္အေရးနဲ႔ ပတ္သက္တဲ့ စြပ္စဲြခ်က္အသစ္ေတြ ထပ္မံေပၚေပါက္ေနတာေၾကာင့္ ဒီကိစၥေတြ ဆက္လက္ စံုစမ္းစစ္ေဆးတာၿပီးစီးတဲ့အခ်ိန္ထိ အစီရင္ခံစာတင္ျပမယ့္ရက္ကို တုိးျမွင့္သတ္မွတ္ေၾကာင္း ႏိုင္ငံေတာ္သမၼတလက္မွတ္နဲ႔ အမိန္႔ေၾကညာစာထုတ္ျပန္ခဲ့ပါတယ္။ေကာ္မရွင္ အဖဲြ႔၀င္တဦးျဖစ္တဲ့ ဦးသာဉာဏ္က လြန္ခဲ့တဲ့ရက္ေတြတည္းက အစီရင္ခံစာကို ျပင္ဆင္ၿပီးျဖစ္ေၾကာင္းနဲ႔ ဒီလို ရက္တုိးျမွင့္ရတဲ့ စြပ္စဲြခ်က္အသစ္နဲ႔ပတ္သက္ၿပီး ေသခ်ာ မသိေသးေၾကာင္း အခုလုိ ေျပာဆုိပါတယ္။“အဲဒါ က်ေနာ္တုိ႕ကေတာ့ အခုအထိ ေသခ်ာမသိရေသးပါဘူး။ စဲြခ်က္ေတြကေတာ့ ရွိမွာေပါ့ေနာ္ ၊ သိတာလည္းရွိတယ္၊ မသိတာလည္းရွိတယ္။ အစည္းအေ၀းက်မွ သိရလိမ့္မယ္၊ ဘယ္ဟာကို စြဲ ခ်က္ကို စစ္ေဆးေပးရမလဲဆိုတာ၊ က်ေနာ္တို႔ကေတာ့ ေပးတဲ့ တာ၀န္ကို ရတဲ့အခ်ိန္အတြင္း ၿပီးေအာင္ လုပ္ေပးပါတယ္၊ လႊန္ခဲ့တဲ့ ၃-၄ ရက္ကတည္းက အၿပီးသတ္လုပ္ထားပါတယ္၊ အၿပီးသတ္ လုပ္ၿပီးပါၿပီ။ ဒါေပမယ့္ မေန႔က ရက္စြဲနဲ႔ ထုတ္တဲ့ အမိန္႔အရကေတာ့ ဆက္လက္စံုစမ္းစစ္ေဆးမႈ ၿပီးစီးသည့္အခ်ိန္အထိ အဲလို တိုးျမွင့္သတ္မွတ္လိုက္ပါတယ္။”လက္ရိွၾကံဳေတြ႔ေနရတဲ့ ေကာ္မရွင္ရဲ့စိန္ေခၚမႈနဲ႔ အခက္အခဲေတြကို ဦးသာဉာဏ္က အခုလို ဆက္ေျပာပါတယ္။“နံပတ္ ၁ ကေတာ့ ဘာသာစကားအခက္အခဲေပါ့၊ က်ေနာ္တို႔ ေျပာတာကို သူတို႔ နားမလည္ဘူး၊ သူတို႔ေျပာတာကို က်ေနာ္တို႔ ေတာ္ေတာ္ႀကိဳးစားၿပီး လက္ခံရတယ္။ ေနာက္တခုက က်ေနာ္တို႔ဟာ ႏိုင္ငံေတာ္က ဖြဲ႔တဲ့ အဖြဲ႔အစည္းမွန္ပါတယ္။ သို႔ေသာ္လည္း သြားဆက္သြယ္တဲ့အခါ ရုတ္တရက္ႀကီးေတာ့ စိုးရိမ္တာေပါ့၊ စိုးရိမ္စိတ္နဲ႔ က်ေနာ္တို႕ကို ေတြ႔ဆံုတာရွိတယ္။ အဲဒီေတာ့ က်ေနာ္တို႕က ယံုၾကည္မႈ တည္ေဆာက္ၿပီးေတာ့မွ အမွန္တရားကို ရပါလိမ့္မယ္။ ေျပာခ်င္တဲ့လူေတြရွိတယ္၊ ဒါေပမယ့္ ေျပာခ်င္တဲ့လူေတြကလည္း သူတို႔ အႏၱရာယ္ကို သူတို႔ စိုးရိမ္ေနပါတယ္။ သြားေရးလာေရးလည္း အခက္အခဲရွိတာေပါ့၊ ရြာေတြကို သြားတဲ့အခါ ရြာကို မေရာက္ႏိုင္တဲ့ အခက္အခဲေပါ့။ ရြာကလူေတြကိုလည္း က်ေနာ္တို႔က ဘယ္ေနရာ ဘယ္မွာ လာစုပါ ဆိုၿပီးေတာ့ ေျပာခြင့္မရွိပါဘူး။ က်ေနာ္တို႔ကသာလွ်င္ သူတို႔ ရွိတဲ့ ေနရာကို သြားရမွာပါ၊ အဲဒီေတာ့ ဖိတ္ေခၚရပါတယ္။”အစီရင္ခံစာေနာက္ဆံုးတင္သြင္းႏိုင္မယ့္ရက္ကိုလည္း ျပန္လည္ေဆြးေႏြးၿပီးမွသာ ခန္႔မွန္းသတ္မွတ္ႏိုင္မွာျဖစ္ေၾကာင္းလည္း ေျပာပါတယ္။“ဒီစာအရ က်ေနာ္တို႔ အစည္းအေ၀းျပန္ေတြ႔ရမွာပါ။ အဲဒီအခါက်ရင္ က်ေနာ္တို႔ ခန္႔မွန္းေျခရက္စဲြ ဆြဲေကာင္းဆြဲမယ္။ ခန္႔မွန္းေျခရက္မဆြဲခင္ က်ေနာ္တို႔ ဘာေတြဆက္လက္လုပ္ဖို႔ လိုေသးသလဲ၊ အဲဒီလုပ္ရမယ့္ေဒသေတြ သြားဖို႔အခ်ိန္ ဘယ္ေလာက္ယူရမလဲ၊အဲဒါေတြေလ့လာဖို႔ က်ေနာ္တို႔ ဘယ္လိုဗ်ဴဟာေတြ ျပန္ဆြဲမလဲ၊ ဘယ္လိုလုပ္ငန္းေတြ တာ၀န္ခြဲေ၀ သတ္မွတ္မလဲ ၊ အဲဒီအေပၚမွာ က်ေနာ္တို႔အဖြဲ႔မွာ အၾကံျပဳလာတာေတြ ရွိမွာေပါ့ အဲဒီအၾကံျပဳခ်က္ေတြကို မူတည္ၿပီးေတာ့ ရက္ကို ခန္႔မွန္းထားရပါလိမ့္မယ္။”အၾကမ္းဖက္တုိက္ခုိက္သူေတြကို ရွာေဖြဖမ္းဆီးခ်ိန္နဲ႔ နယ္ေျမရွင္းလင္းခ်ိန္မွာ အစိုးရလံုၿခံဳေရးတပ္ဖဲြ႔ေတြက လူ႔အခြင့္အေရးခ်ိဳးေဖာက္တာေတြ ရိွေၾကာင္းလည္း သတင္းေတြ ထြက္ေပၚေနပါတယ္။ၿပီးခဲ့တဲ့ ဒီဇင္ဘာလ ၁၄ရက္ေန႔က ေကာ္မရွင္က သတင္းထုတ္ျပန္ရာမွာ The Guardian သတင္းစာ၊ South China Morning Post Websiteမွာ ၁၁-၁၂-၂၀၁၆ နဲ႔ ေဖာ္ျပခဲ့တဲ့ ေမာင္ေတာေဒသက အမ်ိဳးသမီးေတြ အဓမၼျပဳက်င့္တဲ့သတင္းနဲ႔ ပတ္သက္ၿပီး စံုစမ္းစစ္ေဆးခဲ့ေၾကာင္းနဲ႔ အခင္းျဖစ္ပြားမႈကို မေတြ႔ရေၾကာင္း ထုတ္ျပန္ထားပါတယ္။ေမာင္ေတာေဒသအၾကမ္းဖက္မႈဟာ၂၀၁၆ခုႏွစ္ ေအာက္တိုဘာလ ၉ရက္ေန႔မွာ စတင္ျဖစ္ပြားၿပီး နယ္ျခားေစာင့္ရဲကြပ္ကဲမႈဌာနခ်ဳပ္နဲ႔ အျခားစခန္း၂ခု တုိက္ခုိက္ခံရၿပီး ရဲတပ္ဖဲြ႔၀င္ ၉ေယာက္က်ဆံုးခဲ့ရသလို လက္နက္မ်ိဳးစံု ၄၈လက္နဲ႔ က်ည္ ၆ေထာင္၅ရာေက်ာ္ဆံုးရံႈးခဲ့ပါတယ္။ အၾကမ္္းဖက္အဖဲြ႔ဖက္က ၈ေယာက္ေသဆံုးၿပီး ၂ေယာက္ အရွင္ဖမ္းဆီးရမိခဲ့ပါတယ္။ဒုတိယအၾကိမ္တုိက္ခုိက္မႈကေတာ့ ႏို၀င္ဘာလ ၁၂ရက္နဲ႔ ၁၃ရက္ေတြမွာ ထပ္မံျဖစ္ပြားခဲ့ၿပီး ၁၂ရက္ေန႔ တုိက္ခုိက္မႈမွာ တပ္မေတာ္စစ္ေၾကာင္းကို အၾကမ္းဖက္ သမား ၆၀၀ ေလာက္က ၀ိုင္းရံတုိက္ခိုက္တာေၾကာင့္ ရဟတ္ယာဥ္ ၂စင္းနဲ႔ ေလေၾကာင္း က တုံ႔ျပန္တုိက္ခိုက္ခဲ့ရေၾကာင္း အစိုးရက သတင္းထုတ္ျပန္ခဲ့ပါတယ္။Embedshareရခိုင္ေကာ္မရွင္အစီရင္ခံတင္ဖ္ို႔ ရက္ေရႊ႕ဆိုင္းby ဗီြအိုေအEmbedshareThe code has been copied to your clipboard.The URL has been copied to your clipboardFacebook တြင္ျဖန္႔ေ၀ရန္ Twitter တြင္ျဖန္႔ေ၀ရန္ No media source currently available0:004:420:00တိုက္႐ိုက္ လင့္ခ္128 kbps | MP332 kbps | MP3သီးျခားခြဲထုတ္၍ နားဆင္ႏုိင္ပါသည္။ ကိုမိုးေဇာ္မွာယူရန္,https://burmese.voanews.com/a/rahkine-investigation-commission-/3699917.html,TRUE
